{"$schema":"https://json-schema.org/draft/2020-12/schema","$id":"https://nexa.local/starbench/entitlement-snapshot-ref-v0.1.schema.json","title":"Entitlement Snapshot Ref V0.1","type":"object","additionalProperties":false,"required":["schema_version","record_type","snapshot_ref","authority","subscription_identity","quota_cycle","usage_state","remaining_state","reset_time","model_specific_quota","request_limit","task_limit","token_usage","freshness_status","metadata"],"properties":{"schema_version":{"const":"0.1"},"record_type":{"const":"ENTITLEMENT_SNAPSHOT_REF"},"snapshot_ref":{"type":"string","minLength":1},"authority":{"const":"03-01 AI资产成本"},"subscription_identity":{"type":"object","additionalProperties":false,"required":["subscription_id","plan_id","plan_name"],"properties":{"subscription_id":{"type":["string","null"]},"plan_id":{"type":["string","null"]},"plan_name":{"type":["string","null"]}}},"quota_cycle":{"type":"object","additionalProperties":false,"required":["cycle_start","cycle_end"],"properties":{"cycle_start":{"type":["string","null"],"format":"date-time"},"cycle_end":{"type":["string","null"],"format":"date-time"}}},"usage_state":{"enum":["KNOWN","PARTIAL","UNKNOWN"]},"remaining_state":{"type":"object","additionalProperties":false,"required":["status","value","unit"],"properties":{"status":{"enum":["KNOWN","UNKNOWN"]},"value":{"type":["number","null"],"minimum":0},"unit":{"type":["string","null"]}}},"reset_time":{"type":["string","null"],"format":"date-time"},"model_specific_quota":{"type":"object"},"request_limit":{"type":["integer","null"],"minimum":0},"task_limit":{"type":["integer","null"],"minimum":0},"token_usage":{"type":["integer","null"],"minimum":0},"freshness_status":{"enum":["CURRENT","STALE","UNKNOWN"]},"metadata":{"type":"object"}}}