{"schema_version":"0.1","record_type":"ENTITLEMENT_SNAPSHOT_REF","snapshot_ref":"entitlement-fixture-ref","authority":"03-01 AI资产成本","subscription_identity":{"subscription_id":null,"plan_id":null,"plan_name":null},"quota_cycle":{"cycle_start":null,"cycle_end":null},"usage_state":"UNKNOWN","remaining_state":{"status":"UNKNOWN","value":null,"unit":null},"reset_time":null,"model_specific_quota":{},"request_limit":null,"task_limit":null,"token_usage":null,"freshness_status":"UNKNOWN","metadata":{"source_class":"TEST_FIXTURE"}}