{"schema_version":"0.1","record_type":"ENTITLEMENT_SNAPSHOT_REF","snapshot_ref":"entitlement-fixture-ref","authority":"03-01 AI资产成本","subscription_identity":{"subscription_id":"fixture-subscription","plan_id":"fixture-plan","plan_name":"Fixture Plan"},"quota_cycle":{"cycle_start":"2026-08-01T00:00:00.000Z","cycle_end":"2026-09-01T00:00:00.000Z"},"usage_state":"KNOWN","remaining_state":{"status":"KNOWN","value":75,"unit":"TASK_PERCENT"},"reset_time":"2026-09-01T00:00:00.000Z","model_specific_quota":{"fixture-code-model":{"status":"KNOWN","remaining":40,"unit":"REQUESTS"}},"request_limit":100,"task_limit":80,"token_usage":50000,"freshness_status":"CURRENT","metadata":{"source_class":"TEST_FIXTURE"}}